{
  "schema_version": 2,
  "ts": "2026-09-08T00:00:00Z",
  "session_id": "0c897328-fb17-4db6-8580-efc9776c7a6d",
  "sensor": {
    "id": "branch-01-sensor-01",
    "environment": "production",
    "tags": {
      "site": "branch-01"
    }
  },
  "endpoint": "admin-http",
  "protocol": "http",
  "src": "198.51.100.23:54321",
  "dst": "192.0.2.10:8080",
  "dst_port": 8080,
  "duration_ms": 12,
  "bytes_received": 83,
  "payload_captured": false,
  "bytes_truncated": false,
  "data_preview_hex": "",
  "data_preview_ascii": "",
  "privacy_mode": "metadata",
  "events": [
    {
      "type": "http_request",
      "method": "GET",
      "path": "/admin",
      "version": "HTTP/1.1",
      "host": null,
      "user_agent": null
    }
  ],
  "events_truncated": false,
  "close_reason": "server_closed"
}
